2025-05-22,"Αιμιλία, Εμιλία, Έμιλυ, Έμμα, Μίλια, Αιμίλιος, Μίλιος"
2025-05-26,"Αλφαίος, Καρπός, Συνέσιος, Συνέσης, Συνεσία"
2025-05-27,"Αλύπιος, Αλυπία, Θεράπων, ΙωάννηςοΡώσσος"
2025-05-28,"Διοσκουρίδης, Διοσκορίδης, Διόσκορος"
2025-05-29,"Θεοδοσία, Θεοδόσω, Ολιβιανός, Ολβιανός, Ολιβία, Ολίβια, Υπομονή, Νεφέλη"
2025-05-30,"Εμμέλεια, Εμμελεία"
2025-05-31,"Ερμείας, Ερμειάς, Ερμεία, Μάγια, Μάγος"
2025-06-01,"Ευέλπιστος, Ευελπίστη, Ιέραξ, Ιέρακας, Γέρακας, Γεράκης, Γερακίνα, Πύρρος, Πύρος, Πύρρα, Πύρα, Θεσπέσιος, Θεσπέσης, Θεσπέσια, Ιουστίνος"
2025-06-02,"Μαρίνος, Νικηφόρος, Νικηφορία, Νικηφόρα"
2025-06-03,"Ιερία, Ιέρεια, Υπατία, Υπατή, Υπατούλα, Πατούλα"
2025-06-04,Μάρθα
2025-06-05,"Δωροθέα, Δωρόθεος, Πλούταρχος, Κύνθια, Κυνθία, Απόλλωνας, Απόλλων, Νικανδρία, Νίκη, Νίκανδρος, Σεληνιάς, Σελήνος, Σελήνιος, Σεληνιάδα, Σεληνία, Σελήνη, Σελήνα"
2025-06-06,"Ιλαρίων, Ιλαρίωνας, Ιλαρία, Ιλαριάδα, Λαριάδα"
2025-06-07,"Ζηναΐς, Ζηναΐδα, Παναγής, Πανάγος, Σεβαστιανή, Σεβαστίνα, Σεβαστιάνα, Σεβαστή, Σέβη, Σεβούλα, Σεβαστούλα"
2025-06-08,"Καλλιόπη, Καλλιοπία, Πόπη, Κάλια, Πίτσα, Ναυκράτιος, Ναυκράτης"
2025-06-09,"Ροδάνθη, Ροζάνθη, Τριάδα, Τριάς, Κορίνος, Κόρη, Κορίνα"
2025-06-11,"Βαρθολομαίος, Βαρνάβας, Λουκάς, Λουκία, Λουκίτσα, Ζαφειρία, Ζαφείρω, Ζαφείριος, Ζαφείρης"
2025-06-12,"Ονούφριος, Ονούφρης, Ονουφρία"
2025-06-13,"Τριφύλλιος, Τριφύλιος"
2025-06-14,"Ελισσαίος, Ελισσώ, Ελισώ, Νήφων"
2025-06-15,"Αυγουστίνος, Αυγουστίνα, Αύγουστος, Αυγούστα, Ιερώνυμος, Γερώνυμος, Ιερονύμη, Μόνικα, Μόνα, Ορτίσιος, Ορτίσης, Ορτίσια, Ορτανσία, Αγαμέμνονας, Αγαμέμνων, Αγησίλαος, Αγόρω, Αγορίτσα, Ρίτα, Αίολος, Άλκηστις, Αλκμήνη, Ανδρομέδα, Αντιόπη, Αριστομένης, Αρθούρος, Βελισάριος, Βενέτιος, Βενετία, Βενιζέλος, Βιολέτα, Βρασίδας, Διαγόρας, Δίκαιος, Εβελίνα, Έβελιν, Έκτορας, Ελβίρα, Εριφύλη, Ερρίκος, Έρικ, Ερωτόκριτος, Ευαγόρας, Ευριπίδης, Ευρυδίκη, Φαίδων, Φαίδωνας, Φειδίας, Φραγκίσκος, Φρατζέσκα, Γιασεμή, Γιασμίνα, Γιολάντα, Γλαύκος, Ηλέκτρα, Ιοκάστη, Ισαβέλα, Καλομοίρα, Καλυψώ, Κανέλος, Κανέλα, Νέλλη, Κασσάνδρα, Κίμων, Κίμωνας, Κίρκη, Κλάρα, Κλεάνθης, Κλεάνθη, Κλέαρχος, Κλεομένης, Κομνηνός, Κρίτων, Κρίτωνας, Κυβέλη, Λαέρτης, Λογοθέτης, Λυκούργος, Λύσανδρος, Μανταλένα, Μάνθος, Μανθούλα, Μίνωας, Μιράντα, Μιρέλα, Μυρτώ, Ναυσικά, Νεοκλής, Νεοπτόλεμος, Νιόβη, Οφηλία, Ορφέας, Όθων, Όθωνας, Παγώνα, Πανωραία, Περίανδρος, Πραξιτέλης, Πυθαγόρας, Ροδοθέα, Τερέζα, Τερψιθέα, Θέλξη, Θρασύβουλος, Θράσος, Τιμολέων, Άγις, Αίσωπος, Αλβέρτος, Αλκίνοος, Αμφιτρίτη, Αναξίμανδρος, Ανδροκλής, Αρετή, Αρετούσα, Εριέττα, Έρη, Έρρικα, Γοργίας, Ήρα, Ηρώ, Ιόλη, Ιπποκράτης, Κάρολος, Καρολίνα, Μαλβίνα, Μέλισσα, Μελίσσα, Ναπολέων, Ναπολέωντας, Σεμίνα, Οδέττη, Ζώτος, Αλφρέδος, Αρμονία, Ηώ, Ήβη, Ινώ, Κλαίρη, Λάνα, Λάρα, Λίλα, Λίλιαν, Μαρίσσα, Κυρήνη, Μηλινόη, Νία, Ρέα, Υβόννη, Βεατρίκη, Άρια, Άρυα, Καλλίµαχος, Κρατερός, Πολυκράτης, Πούλια"
2025-06-17,"Ισμαήλ, Ισμαήλης, Ισμαήλος, Σμαήλης, Σμαήλος, Μαήλης, Μαήλος, Φήλιξ, Φίληξ, Φίλιξ, Φίληκας, Φίληξα, Φιλήκη, Φηλικίτη"
2025-06-18,"Έρασμος, Λεόντιος, Λεοντία, Λεοντίνα, Λεοντίτσα, Αλίνα, Αλένα"
2025-06-19,"Παΐσιος, Παΐσης, Παϊσία, Ιούδας, Ζώσιμος, Ζώσης, Ζήσιμος, Ζήσης, Ζωσιμαίος, Ζώσα, Ζωσιμαία"
2025-06-20,"Μεθόδιος, Έκτορας"
2025-06-21,"Αφροδίσιος, Αφροδισία"
2025-06-22,"Ζήνα, Ζένα, Ζένια, Ζηνάς, Ζένας, Ζένος, Ευσεβεία, Σέβη, Ευσεβούλα, Σεβούλα, Ευσέβιος, Ευσεβής"
2025-06-23,"Αριστοκλής, Αριστοκλέας, Αριστόκλεος, Αγριππίνα, Λούλου, Λούλα, Λούλης"
2025-06-24,"Ερρίκος, Έρικ"
2025-06-25,"Λίβιος, Λίβας, Λιβύη, Έρως, Έρωτας, Φεβρωνία, Φευρωνία, Φεύρω, Φέβρω, Φέβρα, Φεύρα, Φεβρούλα, Φευρούλα, Φευρωνίτσα, Φεβρωνίτσα"
2025-06-26,"Μακάριος, Μακάρης, Μακαράς, Μακαρία, Μακάρω, Μακαρίτσα, Μακαρούλα"
2025-06-27,"Πιερής, Πιέρος, Πιέριος, Πιέρης, Πιερίων, Πιερία, Πιέρα, Σαμψών"
2025-06-28,"Ανάργυρος, Ανάργυρη, Αναργυρούλα, Γερμανός"
2025-06-29,"Πέτρος, Πετρής, Πετράς, Πετράκης, Πετρουλάς, Πετρίνος, Πέτρα, Πετρούλα, Πετρία, Πετρίνα, Παύλος, Πώλ, Παυλίνα, Πωλίνα, Παύλιανη, Πάολα"
2025-06-30,"Απόστολος, Τόλης, Αποστόλης, Λάκης, Αποστολία, Λία, Αποστολίνα, Πολίνα, Λίνα, Μελίτων, Μελίτωνας, Μελίτος, Μελίτης, Γερβάσιος, Γερβασία"
2025-07-01,"Ανάργυρος, Ανάργυρη, Αναργυρούλα, Δαμιανός, Δαμιανή, Κοσμάς, Μαυρίκιος, Μαυρίκης, Μωρίς, Μαυρικία, Μαυρίκα"
2025-07-02,"Ιουβενάλιος, Ιουβενάλης, Γιουβενάλης, Ιουβεναλία"
2025-07-03,"Ανατόλιος, Ζουμπουλία, Υάκινθος, Υακίνθη, Υάνθη, Ιάνθη"
2025-07-05,"Λαμπαδός, Λαμπαδία, Λαμπαδίνα, Λαμπαδή"
2025-07-06,"Λύκιος, Λυκίας, Λυκία, Σάτυρος, Σάτος, Σισώης"
2025-07-07,"Κυριακή, Κυριακίτσα, Κική, Κίκα, Κικίτσα, Κίτσα, Κορίνα, Ντομένικα, Σάντυ, Κούλα, Οδυσσέας"
2025-07-08,"Θεόφιλος, Θεοφίλη, θεοφιλία, Θεοφιλίτσα, Φιλιώ, Φιλίτσα, Φίλια, Προκόπιος, Προκόπης, Προκοπία"
2025-07-09,"Παγκράτιος, Παγκρατία"
2025-07-10,"Αμαλία, Αμελί"
2025-07-11,"Ευφημία, Εύφημη, Εύφη, Ευφημούλα, Ευφούλα, Φούλα, Εύφημος, Όλγα"
2025-07-12,"Βερονίκη, Βερόνικα, Βέρα, Βερενίκη, Παΐσιος, Παΐσης, Παϊσία, Ιλάριος"
2025-07-13,"Σάρα, Σάρρα, Ηλιόφωτος"
2025-07-14,"Νικόδημος, Ακύλας"
2025-07-15,"Βλαδίμηρος, Βλαντίμηρος, Κήρυκος, Ιουλίτα, Ιουλίτη, Ιουλίττα, Ιουλίττη, Γιουλίτα, Γιουλίτη"
2025-07-17,"Μαρίνα, Μαρίνος, Αλίκη, Αλεξάνδρα, Αλεξία, Αλέξω, Αλέκα, Σάντρα, Σάσα"
2025-07-18,"Αιμιλιανή, Αιμιλία, Έμμυ, Αιμιλιανός, Αιμίλιος"
2025-07-19,"Γαρυφαλλιά, Γαριφαλιά, Διός, Δίας, Μακρίνα"
2025-07-20,"Ηλίας, Λιάκος, Λιάκουρας, Λίας, Ηλιάνα, Λιάνα, Ηλιάννα, Ήλια"
2025-07-22,"Μαγδαληνή, Μάγδα, Μαγδούλα, Μαγδαλένα, Μαγδαλένια, Μαγδαλή, Μαγδάλω, Μαριλένα, Μαριαλένα, ΜαρίαΕλένη, Μαρκέλλα, Μαρκέλα, Μαρκελλή, Μαρκελή, Μενέλαος"
2025-07-24,"Χριστίνα, Χριστιάνα, Κριστιάνα, Χρίστα, Κρίστα, Χρίστη, Κρίστη, Χριστινάκι, Αθηναγόρας"
2025-07-25,"Άννα, Αννίτα, Αννέτα, Ανναμπέλλα, Ανναμαρία, Ανέζα, Άννη, ΆνναΜαρία, Άννα-Μαρία, Ευπράξιος, Εύπραξος, Ευπραξία, Ευπραξούλα, Πραξούλα, Έφη, Ολυμπία, Ολυμπιάδα, Ολύμπω, Ολύμπη, Όλια, Ολυμπούλα, Ολυμπιάς"
2025-07-26,"Ερμόλαος, Ερμολία, Λία, Παρασκευή, Εύη, Εβίτα, Βούλα, Βιβή, Βέτη, Βέττη, Παρασκευούλα, Πάρις, Βίβιαν, Παρασκευάς, Πάρης, Πάρις, Έρση, Ωραιοζήλη, Ωραιοζηλία, Ζήλια, Ζήλη, Ζέλια"
2025-07-27,"Παντελεήμων, Παντελεήμωνας, Παντελής, Παντελεήμονας, Παντελάκης, Παντέλος, Παντελίτσα, Παντελίνα, Παντελεούσα"
2025-07-28,"Ακάκιος, Κάχι, Κάκι, Αυξέντιος, Αυξέντης, Αυξεντία, Αυξεντούλα, Δρόσος, Δροσίδα, Δροσούλα, Δροσία, Δρόσω, Δροσοσταλία, Δροσοσταλίδα, Δροσίς, Τίμων, Τίμος, Τιμόνα, Τιμόνη, Τίμα, Ειρήνη, Ρένα, Ρήνα, Ρηνιώ, Ρηνούλα, Ειρήνα, Ειρήνγκω, Ρένια, Χρυσοβαλάντω, Χρυσοβαλάντου, Χρυσοβαλαντία, Βαλάντα, Βαλάντω, Χρυσοβαλάντης, Βαλάντης, Βαλάντος, Χρυσοβαλάντος"
2025-07-29,"Θεόδοτος, Θεοδότης, Θεοδότη, Καλλίνικος, Καλλινίκης"
2025-07-30,"Ανδρόνικος, Ανδρονίκη, Σιλουανός, Σιλουανή, Σιλουάνα, Σιλουάνια, Κρήσκης, Επαινετός, Επαινετή"
2025-07-31,"Ευδόκιμος, Ευδόκιμη, Ιωσήφ, Σήφης, Ιωσηφίνα, Ζοζεφίνα, Τζέσικα, Τζέσσικα, Φρειδερίκος, Φρειδερίκη"
2025-08-01,"Ελέσα, Ελέσσα, Εύκλεος, Ευκλεή, Ευκλέα, Μάρκελος, Σολομονή, Κασσάνδρα"
2025-08-02,Ιουστινιανός
2025-08-03,"Ολύμπιος, Σαλώμη, Σαλώμα"
2025-08-04,"Μαξιμιλιανός, Ξακουστός, Εξακουστοδιανός, Εξακουστωδιανός, Εξακουστός, Ξακουστή"
2025-08-05,"Νόννα, Νόνα"
2025-08-06,"Σωτήριος, Σωτήρης, Σώτος, Σώτης, Σωτηρία, Σωτήρω, Σωτία, Ευμορφία, Μορφούλα"
2025-08-07,"Αστέριος, Αστέρης, Αστρινός, Αστερινός, Αστρινή, Αστέρω, Αστερία, Αστρούλα, Αστερινή, Νικάνωρ, Νικάνορας"
2025-08-08,"Μύρων, Μύρωνας, Μύρα, Μίρκα, Τριαντάφυλλος, Τριανταφύλλης, Φύλλης, Φύλλιος, Τριανταφυλλένιος, Τριανταφυλλιά, Φύλλη, Φύλλια, Φυλλιώ, Φυλλίτσα, Τριανταφυλλένια, Ρόζα"
2025-08-10,"Ηρωνία, Ηρώ, Ήρων, Λαυρεντία, Λώρα, Λωραίνη, Λάουρα, Λαυρεντίνα, Λαυρέντιος, Λαυρέντης, Ιππόλυτος, Ιππολύτη, Ιππολύτα, Πόλυ"
2025-08-11,"Εύπλους, Εύπλος, Εύπλοος"
2025-08-15,"Παναγιώτης, Πάνος, Πανούσος, Παναγής, Πανάγος, Γιώτης, Τάκης, Πανίκος, Παναγιώτα, Γιώτα, Παναγιούλα, Γιούλα, Παναγούλα, Πένυ, Νάγια, Πανυχρούλα, Δέσποινα, Δέσπω, Ντέπη, Πέπη, Ζέπω, Μαρία, Μαργέτα, Μαριέττα, Μαργετίνα, Μάρω, Μαριωρή, Μαρίκα, Μαριγώ, Μαριγούλα, Μαρούλα, Μαρίτσα, Μανιώ, Μαίρη, Μαρινίκη, Μυρέλλα, Μάνια, Μάρα, Μάριος, Γεσθημανή, Ιεσθημανή, Θεοτόκης, Θεοτοκία, Μαριάντζελα, Μαρινέλα, Ελεούσα, Λούση, Ελώνα, Ελλώνα, Ελόνα, Ηλιοστάλακτη, Καθολική, Κρυστάλλω, Κρουστάλλω, Κρουστάλω, Κρυσταλία, Κρυσταλλία, Κρουσταλένια, Πρέσβεια, Πρεσβεία, Συμέλα, Σιμέλα, Σουμελά"
2025-08-16,"Αλκιβιάδης, Άλκης, Άλτσος, Γεράσιμος, Μάκης, Μικές, Μίκης, Γερασιμούλα, Διομήδης, Σεραφείμ, Σεραφειμία, Σεραφείμα, Σεραφίνα, Σεραφειμή, Σεραφειμούλα, Σεραφειμίτσα, Σαράντης, Σαράντος, Σαράντω, Σαραντούλα, Απόστολος, Τόλης, Αποστόλης, Λάκης, Αποστολία, Λία, Αποστολίνα, Πολίνα, Λίνα, Σταμάτης, Σταμάτιος, Στάμος, Σταμούλης, Σταμέλος, Σταμέλης, Σταμελάς, Σταματία, Μάτα, Ματούλα, Ματίνα, Σταματίνα, Σταμάτα, Σταμέλα, Σταμούλα, Σταματή, Μάτω, Σταματέλλα"
2025-08-17,"Λευκοθέα, Λευκοθέη, Μύρων, Μύρωνας, Μύρα, Μίρκα, Στράτος, Στράτων, Στράτης, Στράτα, Στρατία, Στρατίνα, Στρατούλα"
2025-08-18,"Αρσένιος, Αρσένης, Αρσενία, Αρσίνα, Αρσινόη, Λαύρος, Λαύρης, Λάουρος, Λαύρα, Λάουρα, Φλώρα, Φλωρή, Φλωρίτσα, Φλώρος, Φλώρης"
2025-08-20,"Ηλιόδωρος, Ηλιοδώρα, Ελεοδώρα, Έλντα, Θεοχάρης, Θεοχαρούλα, Χαρούλα, Σαμουήλ, Σαμουήλος, Σαμουήλης, Σαμουέλος, Σαμουηλία, Σαμουήλα, Σαμουέλα, Σαμάνθα, Ορέστης, Ορεστιάς, Ορεστία, Ορεστιάδα"
2025-08-22,"Αγαθόνικος, Θεοπρέπιος, Θεοπρεπής, Θεοπρεπία, Θεοπρεπή"
2025-08-24,"Αιτωλία, Ευτυχία, Ευτυχούλα, Ευτυχίτσα, Έφη, Ευτύχιος, Ευτύχης"
2025-08-25,"Βαρθολομαίος, Τίτος, Τίτης, Τίτα, Τίτη"
2025-08-26,"Αδριανή, Ανδριαννή, Ανδριάνα, Αντριάνα, Αδριανός, Ναταλία, Ναταλίνα, Ναταλή, Νάταλι"
2025-08-27,"Αρκάδιος, Αρκάδης, Αρκαδία, Αρκάδα, Λιβέριος, Λυμπέρης, Λιμπέρης, Λιμπέριος, Λιβέρης, Όσιος, Οσία, Φανουρία, Φανή, Φανούλα, Φανούριος, Φανούρης, Φάνης, Νούρης"
2025-08-28,"Δάμων, Δάμωνας"
2025-08-30,"Αλέξανδρος, Αλέκος, Αλέξης, Άλεξ, Αλεξάνδρα, Αλεξάντρα, Αλεξία, Αλέκα, Αλέξο, Αλέξω, Σάντρα, Ευλάλιος, Ευλαλία, Φύλακας"
2025-09-01,"Αδαμάντιος, Αδάμος, Αδάμας, Διαμαντής, Αδαμαντία, Αμάντα, Άντα, Διαμάντω, Ρουμπίνη, Μαντώ, Αθηνά, Ακριβή, Αντιγόνη, Γόνη, Ασπασία, Αφροδίτη, Φρέγια, Διώνη, Διόνη, Δωδώνη, Ελπινίκη, Ερασμία, Ερατώ, Τέτη, Ευτέρπη, Θάλεια, Θεανώ, Θεονύμφη, Καλλιρόη, Καλλιρρόη, Καλλίστη, Κλειώ, Κλεονίκη, Κλεοπάτρα, Κλειώ, Πάτρα, Πατρούλα, Πατρίτσα, Κοραλία, Ραλλία, Ραλία, Ραλλού, Ραλού, Ράλλης, Μαργαρίτα, Μαργαριταρένια, Ρίτα, Μαργαρίτης, Μαριάνθη, Μελπομένη, Μέλπω, Μόσχω, Μοσχούλα, Ουρανία, Ράνια, Πανδώρα, Πηνελόπη, Μπηλιώ, Μπιλιώ, Πίτσα, Πολύμνια, Πολυνίκη, Πολύνα, Πόλυ, Σαπφώ, Τερψιχόρη, Χάιδω, Χαϊδευτός, Χαρίκλεια, Χαρά, Χαρούλα, Ιησούς, Μελέτιος, Μελέτης, Μελετία, Μελετούλα, Μελετίνα, Συμεών, Συμεώνης, Σύμος, Συμεωνή, Συμεωνία, Συμεώνα, Σύμη, Ισμήνη, Πολυτίμη"
2025-09-02,"Μάμας, Μάμαντας, Μάμα"
2025-09-03,"Άνθιμος, Άνθιμη, Αριστέα, Αρίστη, Αριστίων, Αριστίωνας, Αριστέας, Αρχοντής, Αρχοντίων, Αρχοντίωνας, Αρχοντία, Αρχοντή, Αρχοντούλα, Αρχόντισσα, Αρχόντω, Πολύδωρος, Πολύδωρας, Πόλης, Πολυδώρης, Πόλη, Πολυδώρα, Πόλα, Πολυδώρη, Φοίβος, Φοίβη"
2025-09-04,"Ερμιόνη, Ερμίνα, Μωυσής, Μωσής, Μωυσία, Μωσία, Ροζαλία, Ρόζυ, Ρόζα, Ωκεανός, Ωκεάνιος, Ωκεάνης, Ωκεανία, Ωκεανή, Ωκεανίς"
2025-09-05,"Ζαχαρίας, Ζάχαρης, Ζάχαρος, Ζάκι, Ζάκης, Ζαχαρένια, Ζαχάρω, Ζαχαρούλα, Ζαχαρίτσα"
2025-09-06,"Βίβος, Βιβή, Ευδόξιος, Ευδόξης, Δόξης, Λιγερή"
2025-09-07,"Κασσιανή, Κάσσυ, Κασιανή, Κασία, Κασσιανός, Κασιανός, Κάσσιος, Κάσιος, Κάσσος, Κάσσης, Σώζων, Σώζος, Σώζης, Σώζη, Σωζούσα, Σώζα"
2025-09-08,"Δέσποινα, Δέσπω, Ντέπη, Πέπη, Ζέπω, Γενέθλιος, Σκιαδενή, Τσαμπίκα, Μίκα, Τσαμπίκος"
2025-09-09,"Ιωακείμ, Ιωακειμάκης, Μάκης, Κιαράν, Κιάρα"
2025-09-10,"Κλήμης, Κλημεντίνη, Κλημεντίνα, Κλεμεντίνη, Κλεμεντίνα, Μηνοδώρα, Μητροδώρα, Πουλχερία, Πουλχερίνα, Πουλχερίτσα, Πουλχέρω, Πουλχέρη"
2025-09-11,"Ευανθία, Εύα, Ευάνθης, Ευφρόσυνος, Φρόσυνος"
2025-09-13,"Αριστείδης, Αρίστος, Άρης, Αριστέα, Αριστούλα, Αριστίνα, Κορνήλιος, Κορνήλης, Κορνήλος, Κορνηλία, Κορνήλα"
2025-09-14,"Θεοκλής, Θεοκλέας, Θεόκλεια, Σταύρος, Σταυριανός, Σταύρακας, Σταυράκιος, Σταυρής, Σταυράκης, Σταυρούλα, Σταυριανή, Σταυρίνα, Σταυρία"
2025-09-15,"Βησσαρίων, Βησσαρίωνας, Βησσάρης, Βησσαρία, Νικήτας, Νικήτη, Νικήτα"
2025-09-16,"Ευφημία, Εύφημη, Εύφη, Ευφημούλα, Ευφούλα, Φούλα, Εύφημος, Λουντμίλλα, Λουντμίλα, Μελιτινή, Μελιτίνη, Μελιτίνα, Μελίτη, Μελίτα, Μελίνα, Μελιτίνος, Μελίνα"
2025-09-17,"Σοφία, Σόνια, Σοφιανή, Σόφη, Σοφίνα, Φιφή, Σοφούλα, Σοφίτσα, Σοφάκι, Σοφιανός, Σοφούλης, Πίστη, Πίστις, Ελπίδα, Ελπίς, Αγάπη, Αγάπιος, Σοφιάννα, Αγαθοκλής, Αγαθοκλέας, Αγαθόκλεια, Ολιβιανός, Ολβιανός, Ολιβία, Ολίβια, Παντολέων, Παντολέοντας, Παντολεοντής, Παντολεοντία, Παντολεοντή, Πηλεύς, Πηλέας"
2025-09-18,"Αριάδνη, Αριάνα, Ευμένιος, Ευμένης, Ευμενία, Κάστωρ, Κάστορας, Κάστορης, Ρωμύλος, Ρωμύλιος, Ρωμύλης, Ρωμύλα, Ρωμυλία, Ρωμύλη, Ρωμυλαία"
2025-09-19,"Σαββάτιος, Σάββατος, Σαββάτης, Σαββατία, Σαββατίνα, Σαββάτα, Σαββάτη, Σαββάτω"
2025-09-20,"Ευστάθιος, Στάθης, Σταθάς, Σταθάκος, Ευσταθία, Σταθούλα, Σταθία, Ευσταθούλα, Θεοπίστη, Πίστη, Θεόπιστος"
2025-09-21,"Ίωνας, Ιωνάς, Ίων, Ιωνία"
2025-09-22,"Ζωγραφιά, Λουίζα, Λοΐζος, Φωκάς, Φώκιος, Φώκης, Φωκία, Φωκίνα"
2025-09-23,"Ξανθίππη, Ξανθή, Ξανθούλα, Ξάνθιππος, Πολυξένη, Ξένη, Ξένια, Ραΐς, Ραΐδα, Ίρις, Ίριδα"
2025-09-24,"Θέκλα, Κόπρος, Κόπρις, Μυρσίνη, Μυρτώ, Μυρτιά, Μυρτιδιώτισσα, Μύρτα, Μυρσώ, Αμέρισσα, Μέρσα, Αμερισούδα, Αμερσούδα, Αμέρσσα, Αμέρσα, Πέρσης, Περσεφόνη, Πέρσα, Πέρση"
2025-09-25,"Ευφροσύνη, Φροσύνη, Φρόσω, Ευφροσύνα, Φροσούλα, Φροσού, Έφη"
2025-09-27,"Ακυλίνα, Ακυλίνη, Ακυλήνη, Επίχαρις, Επιχάρια, Ζήνων, Καλλίστρατος, Καλλιστράτης, Καλλιστράτη"
2025-09-28,"Χαρίτων, Χαρίτωνας, Χαρίτος, Αλκίσων"
2025-09-29,Κυριάκος
2025-09-30,"Στρατόνικος, Στράτος, Στρατής, Στρατονίκης, Στρατονίκιος"
2025-10-01,"Ανανίας, Νίνος, Θηρέσιος, Θηρεσία, Ρωμανός, Ρωμάνα, Ρωμανή"
2025-10-02,"Κυπριανός, Κυπριανή, Ιουστίνη, Ιούστα, Γιούστα, Ιουστίνα, Γιουστίνα, Γιουστίνη"
2025-10-03,"Διονύσιος, Διονύσης, Νιόνιος, Νύσης, Ντένης, Διονυσία, Διονυσούλα, Νύσα, Σίσσυ, Ντενίζ, Ντενίς"
2025-10-04,"Βερίνα, Βερίνη, Βέρα, Βερούλα, Βερούλη, Ιερόθεος, Καλλισθένης, Καλλισθένη"
2025-10-05,"Χαριτίνη, Χαριτίνα, Χαρίτη, Τίνα, Χαρά, Μεθοδία, Ερμογένης"
2025-10-06,"Θωμάς, Τομ, Θωμαή, Ερωτηίς, Ερωτηίδα"
2025-10-07,"Σέργιος, Σεργία, Σεργιανή, Σεργιούλα, Βάκχος, Βάκχη, Βακχία, Πολυχρόνης, Πολυχρόνιος, Χρόνης, Πολυχρονία, Πολυχρονούλα"
2025-10-08,"Πελαγία, Πελαγούλα, Πελαγίνα, Πελαγίτσα, Πελαγιώ, Πελαγής, Πελάγιος"
2025-10-09,"Αβραάμ, Αβραμία, Λωτ, Λοτ"
2025-10-10,"Ευλάμπιος, Λάμπης, Ευλάμπης, Ευλαμπία, Ευλαμπή, Λαμπή, Λαμπία, Λάμπω"
